{
    "receivers": [
        "863532de-a97d-4597-989a-e79688f2d5f9", 
        "632d7e6d-7357-44de-a425-a94fbe94974e", 
        "95ef711b-564d-4655-a98b-5b9ccfb419d7", 
        "9ee74607-f831-42f5-af08-a614ce0706df", 
        "1311bf13-869c-45b4-915e-8b4e8b8e26fd", 
        "debcd758-129d-4e0b-a0e3-f1d9ce5edfbc", 
        "0fee9741-e266-4c27-b480-1f897463ea4b", 
        "ef9e58bd-431a-466d-a67f-0318858b981c", 
        "68ca0867-ec4b-4eca-92e0-4c4c668a72b0"
    ], 
    "label": "pipeline 1 default device", 
    "version": "1441723676:366608283", 
    "senders": [], 
    "id": "a370d258-69de-4422-860a-ee4cf32ee9f4", 
    "node_id": "3a25a674-e6eb-4987-84ad-ef479fe4d527",
    "type": "urn:x-nmos:device:pipeline"
}
